party,person,title,text
Democrat,Jeanne Shaheen,Shaheen Statement on Bipartisan Agreement on Coronavirus Economic Response Legislation,"U.S. Senator Jeanne Shaheen (D-NH), a senior member of the Senate Committee on Small Business and Entrepreneurship, issued the following statement after Senate Democrats and Republicans reached a final agreement on new coronavirus response legislation to provide urgent relief to workers, small businesses, health care providers, hospitals and families impacted by this public health crisis. This legislation was the result of around the clock bipartisan negotiations, of which Shaheen helped negotiate provisions to assist small businesses alongside Senators Rubio (R-FL), Cardin (D-MD) and Collins (R-ME).

Commenting on the agreement as a whole, Shaheen said, ""Throughout these negotiations, I've been in constant communication with small businesses, public health officials and local leaders in New Hampshire. Delivering desperately needed assistance to the Granite State has been my top priority -- I've been adamant that we get this legislation right so that it provides real relief to those who need it most, particularly families and small businesses who are struggling. Because of persistent bipartisan negotiations, urgently needed help for New Hampshire is on the way. This bill provides real relief to New Hampshire's working families, particularly hourly and low-income workers, so that they can pay their bills and afford groceries and other necessities. In addition, New Hampshire will get at least $1.25 billion to bolster response efforts across the state -- funding that was secured in recent days during negotiations. I worked very closely with senators from both sides of the aisle to negotiate legislation that helps small businesses stay afloat and continue to meet payroll for their workers. I also fought for additional assistance for our hospitals that will soon see a terrifying surge in patients in the days and weeks ahead. The importance of keeping New Hampshire's hospitals operational with the resources they need to treat a rush of new patients can't be overstated. At my insistence, this bill provides financial support for child care costs for health care workers and other essential workers so that they can continue their vital work on the front lines.""

Shaheen continued, ""It was also important that this legislation have protections in place to prevent large corporations from misusing funding. This bill is by no means perfect and there are certainly additional measures I wish we could have included, but the fact is this bill provides urgently needed help to families, small businesses, hospitals and states who need this assistance quickly. Our work in Congress certainly doesn't end here -- Republicans and Democrats must continue to work across the aisle to overcome this crisis. This is one of those times in history when all Americans need to unite and do what's best for our communities and our country. We are all in this together.""

Below are topline priorities included in the bipartisan economic response package that were secured and supported by Shaheen:

Direct payments to many Americans of as much as $1,200 per person;More than $377 billion for small businesses, which Shaheen helped negotiate, to meet their payroll and expenses, and receive education and assistance throughout the coronavirus pandemic; 4 months of increased unemployment assistance;   More than $100 billion in much needed assistance for hospitals and frontline health care providers, and billions more in funding for the broader health care system;Provides funding to health care and other essential workers for child care costs so that they can continue their important work on the front lines;$150 billion to help state and local governments cover new expenses related to coronavirus response;Significant restrictions and oversight to help ensure that larger corporations protect workers and don't misuse funding through stock buybacks and executive pay increases; and$10 billion in grants to help our nation's airports as the aviation sector grapples with the most steep and potentially sustained decline in air travel in history.By standing firm during negotiations and demanding a better bill, Senator Shaheen helped secure the following in recent days which was not in the original bill proposed by Leader McConnell:

4 months of expanded unemployment insurance instead of 3 months, to include gig economy workers and independent contractors;$150 billion for a state and local Coronavirus Relief fund of which at least $1.25 billion will go to New Hampshire to assist in COVID-19 response efforts;Increased funding to hospitals and other health care providers from $75 billion to $100 billion;More than $30 billion in additional funding to support the broader health care system;$10 billion for Small Business Administration (SBA) emergency grants of up to $10,000 to provide immediate relief for small business operating costs;$17 billion for SBA to cover 6 months of payments for small businesses with existing SBA loans;$30 billion in emergency education funding and $25 billion in emergency transit funding;$30 billion for the Disaster Relief Fund to provide financial assistance to state, local, tribal, and territorial governments, as well as private nonprofits providing critical and essential services; Allowing for rent, mortgage and utility costs to be eligible for SBA loan forgiveness;$900 million for low income heating assistance through LIHEAP;$300 million in assistance for impacted fishermen and processors;Bans stock buybacks during government assistance plus an additional one year for any company receiving a government loan from the bill;A retention tax credit for employers to encourage businesses to keep workers on payroll during the crisis;Income tax exclusion for individuals who are receiving student loan repayment assistance from their employer;Eliminated a $3 billion bailout for big oil;Eliminated a ""secret bailout"" provision that would have allowed bailouts to corporations to be concealed for 6 months; andSaved hundreds of thousands of airline industry jobs and prohibited airlines from stock buybacks and CEO bonuses.Yesterday, Senator Shaheen spoke on the Senate floor about her efforts to improve this legislation for New Hampshire.

In addition to this legislation, Shaheen has fought for and voted in favor of two economic response bills to provide financial relief to states in their response efforts, and to support workers, businesses and families impacted by the spread of the coronavirus. The President signed both bills into law. The first economic package led to New Hampshire receiving an initial $4.9 million in funds from the Centers for Disease Control and Prevention (CDC)."
Democrat,Benjamin L. Cardin,Cardin: Martin Luther King Jr. Led a Movement Guided by Peace and Compassion that Challenged the Forces of Hate and Intolerance,"To commemorate Dr. Martin Luther King Jr. Day 2020, U.S. Senator Ben Cardin (D-Md.), Special Representative on Anti-Semitism, Racism, and Intolerance for the Organization for Security and Cooperation in Europe (OSCE) Parliamentary Assembly, released the following statement.

""On January 20, we honor Rev. Dr. Martin Luther King Jr. and his prolific fight for freedom and equality. At the forefront of the Civil Rights Movement, he called upon the nation and its leaders to codify legal and social equality for black Americans, to eradicate poverty and to ensure fair treatment for all citizens under our great nation. He led a movement guided by peace and compassion that summoned the power to challenge forces of hate and intolerance deeply embedded in our legal system and our national identity. 

""He championed the legislative milestones that continue to shape our society today, but we can't ignore the fact that many who marched with Dr. King, their children, grandchildren, still carry the weight of the economic disparities, ongoing systemic prejudice, and social biases seeded far before the Jim Crow Era. 

""Our broken criminal justice system continues to disproportionately -- and sometimes fatally -- target black lives and communities. Discriminatory profiling still threatens economic progress, health outcomes, and educational and job opportunities. We are still fighting to restore one of the landmark achievements of the Civil Rights Movement, the Voting Rights Act of 1965, which was gutted in the 2013 Shelby v. Holder decision and opened the floodgates for the disenfranchisement of black and minority voters. As the current administration continues to unravel the social safety net, embolden hateful rhetoric and take precise aim at the policies in place to address injustice and inequality, Dr. King's message is more important than ever. 

""It's easy to use this holiday to say ""look how far we've come.' However, when we measure the distance between the ideologies of the past and our present realities, the gulf between freedom and equality for all Americans across racial and socioeconomic strata, we must understand that more than 50 years after his death, we still have much work to make Dr. King's dream a reality.

""Therefore, we must honor him by following in his footsteps and using his legacy to inform the work we do -- in Congress, in the world and within ourselves -- to get there. Dr. King taught us that this fight is ongoing and that it doesn't end after one speech, one protest, or even after one law is passed.

""As long as injustice lives, we must continue the fight to end it. He famously said that ""the arc of the moral universe is long, but it bends toward justice,' in his work, he reminds us that it does not do so on its own but rather through the work of ordinary men and women who choose to be extraordinary citizens and fight hate and injustice wherever it arises."""
Democrat,Jack Reed,Statements on Introduced Bills and Joint Resolution,"BREAK IN TRANSCRIPT

  Mr. REED. Mr. President, today, I am introducing the Strengthening UI  for Coronavirus Impacted Workers and Students Act. For the 30 million  American unemployed workers, the enhanced jobless benefits created in  the CARES Act are a lifeline. However, the Federal Pandemic  Unemployment Compensation, which provides a $600-per-week benefit on  top of an individual's regular unemployment insurance (UI) benefits are  set to expire on July 31, 2020. Arbitrarily cutting these benefits off  in the midst of an ongoing pandemic could make a desperate situation  worse for individuals and harm the economy. Moreover, if these workers  are prematurely pushed back into unsafe work environments, it will  ultimately harm families, businesses, and communities. 

  That is why my new legislation seeks to expand and enhance the  unemployment insurance of the CARES Act. Specifically, this bill would  continue to offer out-of-work Americans the $600-per-week additional  benefit through the end of the year and make it retroactive to the date  of the coronavirus pandemic disaster declaration date. This legislation  would also exempt these pandemic-specific benefits from being factored  into eligibility for means-tested programs, such as Section 8 housing,  SNAP, TANF, and WIC. Furthermore, it would create a $300 Federal  benefit for recent college graduates, students, and others who are  willing and able to work absent COVID-19. but who do not have recent  work history. Finally, this legislation would codify guidance by the  Department of Labor requiring employees who are participating in ``work  sharing'' programs to be able to receive the $600-per-work boost. I  added provisions to the CARES Act to Federally finance these cost- effective and job saving ``work sharing'' programs, which give  struggling companies the flexibility to reduce hours instead of laying  off their workforce, while allowing the employees to collect  unemployment insurance on the days they are not working. 

  The bill is supported by numerous organizations including the  American Federation of Labor and Congress of Industrial Organizations  (AFL-CIO), International Brotherhood of Teamsters, the National  Association for the Advancement of Colored People (NAACP), National  Education Association (NEA), National Employment Law Project (NELP),  National Low Income Housing Coalition (NLIHC), The Arc, United Auto  Workers (UAW), National Alliance on Mental Illness. National  Association of Councils on Developmental Disabilities, National  Disability Rights Network, and National Women's Law Center. 

  We have to be smart and this targeted, temporary measure will help  ensure Americans who are out of work through no fault of their own can  afford food, housing, and medicine until it is safe to go back to work.  I am pleased to join my colleague in the other body, Representative  Kildee, in sponsoring this legislation, and I look forward to working  with my colleagues here and across the Capitol to secure passage of  this important legislation.                                  ______                                   

      By Mr. REED (for himself, Mr. Brown, Mr. Tester, Mr. Schatz, Mr.          Jones, Ms. Smith, Ms. Warren, Ms. Sinema, Mr. Warner, Mr.          Menendez, Mr. Van Hollen, Ms. Cortez Masto, Mr. Kaine, Mr.          Udall, Mr. Booker, Mrs. Feinstein, Mr. Durbin, Mr. Merkley, and          Mr. Wyden): 

  S. 3620. A bill to establish a Housing Assistance Fund at the  Department of the Treasury; to the Committee on Banking, Housing, and  Urban Affairs. 

BREAK IN TRANSCRIPT

  Mr. REED. Mr. President, along with Senators Brown, Tester, Schatz,  Jones, Smith, Warren, Sinema, Warner, Menendez, Van Hollen, Cortez  Masto, Kaine, Udall, Booker, Feinstein, Durbin, Merkley, and Wyden, I  am introducing legislation that would create a $75 billion Housing  Assistance Fund that builds on the success of the Hardest Hit Fund at  the Treasury Department that I championed in 2010. 

  The Hardest Hit Fund provided funds to 18 State-level Housing Finance  Agencies, directing targeted foreclosure prevention assistance to  households and neighborhoods in States like Rhode Island hit hard by  the economic and housing market downturn. 

  The Housing Assistance Fund expands this model to provide a flexible  source Federal aid to all State-level Housing Finance Agencies. This  Federal funding could then be used to help struggling households remain  in their homes while they search for new employment or wait to get back  to work. Financial assistance could go towards preventing eviction,  mortgage delinquency, default, foreclosures, or loss of utility  services, such as water, gas, and  electricity. Funds could also be used to keep the Internet connected  and remain current with property taxes. 

  In the midst of responding to the coronavirus, we clearly need to do  everything we can to help our constituents. According to CNBC, 8.7  million jobs were lost in the Great Recession, and as of April 23,  2020, more than 26 million Americans filed unemployment insurance  claims in just five weeks. Just for comparative purposes, CNBC also  reported that 22.4 million jobs were created since the Great Recession. 

  This means we're facing job losses at an unprecedented scale and  pace. 

  What this also means is that we could be facing a potential wave of  evictions and foreclosures, so there is no time to waste. We should  respond accordingly so that more families can make it to the other side  of this public health emergency while staying safe in their homes. This  is precisely the goal of this Housing Assistance Fund legislation we  are introducing today. 

  I thank the National Council of State Housing Agencies; Habitat for  Humanity; National Housing Conference; National Community Reinvestment  Coalition; National Association of Affordable Housing Lenders; National  Leased Housing Association; Americans for Financial Reform; National  Consumer Law Center, on behalf of its low-income clients; Center for  Responsible Lending; Rhode Island Housing; and the Rhode Island  Association of Realtors for their support. 

  I urge all of my colleagues to join in pressing for inclusion of the  Housing Assistance Fund in our continued response to the coronavirus  pandemic.                                  ______                                   

      By Mr. DURBIN (for himself, Ms. Duckworth, Mr. Blumenthal, Ms.          Stabenow, Mr. Merkley, Mr. Jones, Ms. Klobuchar, Ms. Hirono,          Mrs. Gillibrand, Ms. Smith, Mr. Sanders, Ms. Harris, and Ms.          Baldwin): 

  S. 3634. A bill to address health workforce shortages and disparities  highlighted by the COVID-19 pandemic through additional funding for the  National Health Service Corps and Nurse Corps; to the Committee on  Health, Education, Labor, and Pensions. 

BREAK IN TRANSCRIPT"
Republican,Marsha Blackburn,"Blackburn, Menendez Lead Bipartisan Bill  to Increase US Prescription Drug Manufacturing","Senators Marsha Blackburn (R-Tenn.) and Bob Menendez (D-N.J.) have introduced the Securing America's Medicine Cabinet (SAM-C) Act to increase American manufacturing of active pharmaceutical ingredients (APIs), the building blocks of prescription drugs. Currently, only 28% of API-producing facilities are in the United States and the number of Chinese facilities has more than doubled since 2010.

""When confronted with a serious challenge such as the corona virus, it is important to take stock, look at lessons learned and build upon them in order to respond better the next time,"" said Senator Blackburn. ""Currently, we are too reliant on foreign manufacturing of critical APIs. The SAM-C Act is one step on the right path to strengthen our drug supply chain.""

""The COVID-19 is a real health emergency and we have to do everything in our power to increase our preparedness and response,"" said Senator Menendez. ""This bipartisan proposal will do that by encouraging drug manufacturers to partner with our best minds in higher education on new advancements, creating good jobs and increasing the national production of vaccines and drugs that can save lives. With New Jersey's concentration of pharmaceutical companies and institutes of learning, we can lead the way and make a difference.""

The corona virus outbreak has heightened concerns about dependence upon China and India for prescription medications. On February 27, 2020, the FDA announced the shortage of one drug used to treat patients with coronavirus. They attributed the shortage to difficulties obtaining the API from a site in China affected by coronavirus.

Additionally, in its 2019 report to Congress, the U.S.-China Economic and Security Review Commission revealed ""serious deficiencies in health and safety standards in China's pharmaceutical sector."" Dependence upon China and others for prescription drugs combined with safety concerns needs to be addressed. This urgent health event provides an impetus to improve our pharmaceutical supply chain.

The SAM-C Act will encourage pharmaceutical drug manufacturers to spur innovations similar to those in other industries such as automotive, aerospace and semiconductors and bring drug manufacturing back to the United States, where ingredients and processes can be more easily verified. 

The legislation would expand upon the Emerging Technology Program within the Food and Drug Administration to prioritize issues related to national security and critical drug shortages, as well as bring pharmaceutical manufacturing jobs to the United States. In addition, the SAM-C Act authorizes $100 million to develop centers of excellence in advanced pharmaceutical manufacturing in order to develop these innovations as well as train the workforce needed in this industry. These centers will be partnerships between institutes of learning and the private sector. 

RELATED

Last month, Senator Blackburn wrote about how the coronavirus outbreak exposes the U.S.'s pharma supply chain vulnerability: ""Without intervention, the FDA expects the pharmaceutical industry will continue to rely on Chinese companies to make active pharmaceutical ingredients The status quo has made us vulnerable. The fix, however, is sitting right in front of us."""
Republican,Marsha Blackburn,Blackburn Votes to Acquit President Trump,"Today, Senator Marsha Blackburn gave the following statement after the United States Senate voted to acquit President Donald Trump of abuse of power and obstruction of Congress:

""Over the past three weeks, the Senate considered arguments for and against two articles of impeachment sent over by the House of Representatives: one, charging the President with abuse of power for asking Ukraine to assist him in investigating Hunter Biden's work for Burisma, and a second, charging him with obstruction of Congress.

""To prepare for such a serious event, I read the House Managers' brief and the reports prepared by the House Republicans and the President's counsel. I identified gaps in the case and drafted over three dozen questions I believed required answers, including, How can we be sure the whistleblower's account is accurate? What do public reports of the coordination between the whistleblower and Adam Schiff reveal about his political bias? What is the standard for impeachment in the House, and how does it compare to that for conviction in the Senate?

""Unfortunately, instead of focusing on the facts, the Democratic House Impeachment Managers tried to rely on the pandemonium and rage created by a historic moment to convince their colleagues--and the American people--that justice demanded a do-over.

""The impeachment trial of President Donald J. Trump was a moment in history that should have been shrouded in the gravity of its potential consequences; instead, day after day, we endured hyperbole in its most unserious form.

""One of my colleagues--who is running for President Trump's position--seized an opportunity to pull a political stunt and belittle the Chief Justice of the Supreme Court. How could something as serious as a presidential impeachment warrant forcing a soundbite on the Senate floor? This is exactly why I previously called on the four candidates running for the Democratic nomination to recuse themselves from the trial. Their ambitions prohibited their ability to view this trial through an objective lens--and we saw that on full display in the Senator's question. While this is the first time impeachment has been used as a partisan political tool, it was unseemly that it made its way to the Senate chamber.

""The process was a waste of time and resources, its motivations completely divorced from reality. At taxpayer expense, President Donald Trump's counsel spent weeks litigating a policy disagreement over the President's foreign relations strategy; meanwhile, seven House Democrats shamelessly questioned whether American voters could be trusted to decide for themselves whether the President's agenda and policies were appropriate. By the end of the trial, we'd heard about a cover-up, a quid pro quo, extortion and bribery--all despite the fact that no crime was alleged in the two articles the Senate was tasked with debating.

""History must take note of the lessons we've learned from these destructive methods.

""The House overstepped the bounds of its Article I oversight power, abused its authority and used impeachment for political gain. The House Managers' actions ignored the fact that Congress is guided by history, precedent, and above all, the Constitution; we should thank the Framers for troubleshooting diligently enough that we could be prepared for this scenario.

Fortunately, we saw that when the House ignores precedent in favor of partisan politics, the Senate will not hesitate to put the lower chamber back in its place.

""That's exactly why today I voted to acquit President Trump--because lowering the high bar of impeachment such that any American could be found guilty is far more dangerous than anything the Democratic ""resistance' has asserted.

""My fellow Tennesseans saw right through the games and the intentional mishandling of the Democratic House Managers' constitutional duty. They know this was nothing more than a dangerous and desperate attempt to pre-litigate the 2020 election, and remove President Trump from office--and the ballot. Thanks to the tireless leadership of Majority Leader McConnell, the Senate completed its task. The House Managers failed to prove their case, even by their own standard.

""Will this resolution put an end to Democrats' seemingly endless efforts to remove President Trump from office? I'm not optimistic. But I do know this: It's time we get back to work making everyday life better for Tennesseans.

""I am devoted to making 2020 a productive year for growth, health, and prosperity in the Volunteer State. We need to focus on expanding broadband connectivity, and implementing policies that will support health care delivery in rural communities. We will take new steps to protect online privacy and the ""Virtual You,' and build on the success of last year's efforts to strengthen our national defense.

""The first three years of President Trump's tenure have brought success in securing fairer trade agreements, lowering taxes, confirming rule-of-law judges, protecting life, and rolling back regulations--and believe me, we're just getting started.

""The impeachment of President Donald J. Trump was not a matter of procedure--it was an attempted coup, brought forth at the expense of the safety and prosperity of the American people. Every member of Congress must now reflect, remember, and take to heart the real legacy of this dark moment in history, when ruthless partisanship undermined due process, trampled the rule of law, and very nearly erased from precedent those rules that underpin our democratic republic."""
