party,person,title,text
Democrat,Christopher Murphy,"Murphy, Blumenthal Introduce Legislation Requiring Airlines Return Billions to Consumers During Coronavirus Pandemic","Senators Chris Murphy (D-Conn.) and Richard Blumenthal (D-Conn.), joined by Edward J. Markey (D-Mass.), Elizabeth Warren (D-Mass.), and Kamala Harris (D-Calif.) today announced the Cash Refunds for Coronavirus Cancellations Act of 2020. This legislation would require major airlines and third-party ticket sellers to offer full cash refunds for all cancelled tickets during the coronavirus pandemic, regardless of whether the airline cancelled an entire flight or the passenger cancelled their individual ticket.

""Congress allocated billions of dollars to airlines to help them stay afloat during this pandemic, but the airlines continue to play games with their customers,"" said Murphy. ""Rebooking is impractical for many consumers, especially given the uncertain nature of the future course of the pandemic. I'm proud to join my colleagues in introducing legislation to require the airlines to provide refunds.""

""Americans need and deserve their hard-earned cash back when the pandemic prevents them from flying, no matter when their tickets were booked,"" said Blumenthal. ""Consumers should receive cash refunds, not just credits, regardless of whether they or airlines cancel the flight. Airlines continue to mistreat and mislead taxpayers, after taxpayer money paid for massive bailouts. I'm proud to introduce this legislation with my colleagues to help put an end to this egregious anti-consumer behavior and ensure Americans get cash back in their pockets at this critical time.""

Deciding not to fly is the right choice for public health. Yet, when travelers proactively cancel their tickets, the airline industry only provides vouchers, not cash. And even though airlines are required under federal law to offer cash when they cancel an entire flight, most airlines only offer to rebook passengers or provide a voucher as the default option instead, forcing customers to jump hoops to actually get their money back. In response to these anti-consumer practices, the Senators previously sent a letter to eleven major domestic airlines, demanding cash refunds for all cancelled tickets during the coronavirus pandemic. Their investigation further revealed that the airline industry could be holding onto over $10 billion of hard-earned money from American travelers.

A copy of the legislation can be found HERE.

Specifically, the Cash Refunds for Coronavirus Cancellations Act would:

Require major airlines and third-party ticket sellers to offer full cash refunds for all cancelled tickets during the coronavirus pandemic, no matter whether the airline canceled the overall flight or the passenger canceled their individual ticketPermit airlines and third-party ticket sellers to offer travel vouchers as an alternative to cash refunds, as long as that voucher is valid indefinitely and the offer includes clear and conspicuous notice of the flyer's right to a cash refundAllow airlines to pay for cash refunds with any emergency money made available by Congress, except for the CARES Act grants designated for supporting worker payroll expenses and employee benefitsEstablish that the new right is retroactive to any flight on or after March 1, 2020, so that passengers who previously received a travel voucher, but have not used it, can ask for a cash refund nowMandate that cash refunds be available until 180 days after the end of the nationwide COVID-19 emergency declarations, which will give consumers six extra months of flexibility and peace of mind so they don't have to travel until they truly feel safe flying again""The airlines just received a multi-billion dollar taxpayer bailout and want to continue holding onto passengers' ticket dollars as well. Frankly, that doesn't fly,"" said Janet Domenitz, Board Chair of U.S. PIRG and Executive Director, MassPIRG. ""It's customers' money. Airlines have a responsibility to return it on request during this crisis.""

""Offering vouchers might be a defensible policy in ordinary times, but in a crisis of this magnitude, it is simply unfair to deny refunds to customers who canceled their flights,"" said Anna Laitin, Director of Financial Fairness and Legislative Strategy, Consumer Reports. ""The airlines should provide refunds to all customers whose travel plans were impacted by this unprecedented public health and economic crisis. With so many Americans out of work and facing financial hardship, a voucher for future travel is simply not appropriate or useful.  These consumers need their money back.""

""Consumers, facing one of the most devastating economic catastrophes in our nation's history, need every cent to make ends meet,"" said John Breyault, Vice President of Public Policy, Telecommunications, and Fraud, the National Consumers League. ""It should be unconscionable that airlines would play games with giving consumers cash refunds when flights get canceled. We applaud Senators Markey, Warren, Blumenthal, Murphy, and Harris for introducing this common-sense consumer protection bill which will ensure that consumers get the refunds they deserve without having to jump through the airlines' hoops.""

""Airlines are supposed to serve the public and they should be obliged to put passenger welfare first,"" said Susan Grant, Director of Consumer Protection and Privacy at Consumer Federation of America. ""We support Senator Markey's call for the airlines to offer cash refunds to people who don't want to gamble with their lives by flying during this health emergency."""
Democrat,Jon Tester,"Special pandemic watchdog commits to ""report any undue influence' after Tester presses on independent oversight","Continuing his push to hold government accountable and ensure strict oversight over the $2.2 trillion in pandemic relief aimed at helping workers and small businesses during the coronavirus pandemic, U.S. Senator Jon Tester secured a commitment from Brian Miller, the nominee to be Special Inspector General for Pandemic Recovery, that he would ""report any undue influence on me from whatever source.""

""I've been stonewalled every step of the way trying to get information from this Administration on where this money is going. Every single step of the way,"" said Tester. ""So your position is critically important if we are going to have any level of oversight.""

Tester was instrumental in creating the position of the Special Inspector General for Pandemic Recovery within the Coronavirus Aid, Recovery, and Economic Security (CARES) Act, and he and his colleague Senator Mitt Romney (R-UT) called on the Administration to provide Congress with details about its plans for rigorous oversight.

Following President Trump's removal of Glenn Fine, the Chairman of the Pandemic Response Accountability Committee charged with overseeing the distribution of $2.2 trillion in taxpayer dollars allocated by the CARES Act, Tester urged the heads of every federal agency tasked with pandemic recovery assistance to establish protocols to make sure coronavirus relief funds are targeted to the most affected businesses and individuals, and to update procedures to identify and prevent fraud and abuse. Tester called his removal ""a thumb in the eye to any Montana taxpayer who stands to receive critically-needed financial relief"" from the bill.

And Tester explained to Miller, currently a lawyer in the White House Counsel's office, why Americans could be concerned he will bow to pressure from the Administration to ignore wrongdoing: ""First of all, this is $2.2 trillion dollars in taxpayer money. Second of all, I have watched the President remove Atkinson, the intelligence Inspector General. I have watched him remove Rick Bright when he challenged Hydroxychloroquine. I have watched him remove Colonel Vindeman and his brother when he testified under oath on impeachment. I have watched him remove Glenn Fine. You worked as White House Counsel--the fact is I have no doubt that if you go against the President, he's going to remove you because he's done it time and time and time again."""
Republican,John Cornyn,Letter to Secretary of State Mike Pompeo and U.S. Permanent Representative to the United Nations Kelly Craft - Rubio Joins Colleagues in Urging Administration to Address China's Crackdown of Free Speech,"Dear Secretary Pompeo and Ambassador Craft: As COVID-19 infections spread across the globe, we are grateful for the sacrifices people in every country are making in order to stem the spread of this virus. However, the sacrifice of the freedom of speech is not one that citizens of any nation should have to endure. It has become clear that some leaders are utilizing the virus as a guise to enforce their own illiberal agendas, suppress the free flow of information, increase digital surveillance, and quash dissent. The most visible -- and devastating -- effects of this practice are seen in China, the origin of the pandemic. We now know that suppression of information and censorship of criticism gave room for the virus to propagate and spread. In a March 13 analysis, researchers found that Chinese COVID-19 cases could have been reduced by 86% if measures had been taken two weeks earlier: Reporters Without Borders subsequently created a timeline outlining the progression of the pandemic that could have been halted through free speech and accurate, censorship-free reporting. Globally, the most successful COVID-19 interventions have been those that include transparency, coordination at all levels of government, and an informed and engaged general public. Now, the Chinese Communist Party (CCP) is using this public health emergency as a thin veil to cover a crackdown on peaceful dissent and freedom of speech. China has expelled at least 13 journalists from the New York Times, Wall Street Journal, and Washington Post and banned them from working in Hong Kong and Macau. Additionally, a number of Chinese citizens reporting Wuhan--such as Fang Bin and Chen Qiushi--have disappeared. Populations already suffering under CCP repression, to include Tibetans and Uyghurs, are being targeted and arrested in transparent attempts to suppress their voices. Sadly, China is not unique in its utilization of the pandemic as an excuse to institute surveillance measures or draft new laws that are not necessary, proportionate, transparent, or time-bound. Iran's coronavirus taskforce banned all print media on March 30 to stymie reporting on the virus. Egyptian authorities expelled Guardian correspondent Ruth Michaelson on March 16 after she reported on a scientific study that contained allegedly ""exaggerated"" estimates of the country's number of cases. Venezuelan authorities detained freelance journalist Darvinson Rojas for reporting on the COVID-19 outbreak, and Turkish police detained two executives from the Ses newspaper for publishing a story on local coronavirus deaths. Turkish authorities are also targeting social media, detaining 229 people for making ""provocative"" posts about the coronavirus. Similarly, Cambodian authorities have arrested at least 23 people since January for expressing their views on the virus, and in Niger, activists such as Kaka Touda have been charged with disturbing the public order for posting on Facebook about local cases. Since mid-March, the Bangladeshi government has arrested a dozen people for spreading ""rumors"" around coronavirus, including a doctor, opposition activists, and students, using the draconian Digital Security Act. Thai authorities have arrested artist Danai Ussama for violating the Computer Crimes Act, basing the charge on a Facebook post in which Ussama complained that Bangkok's Suvarnabhumi Airport did not screen him for COVID-19 upon his return from Barcelona. Therefore, we call on the Department of State to document acts of harassment, arrest, increased surveillance, or other forms of suppression or criminalization by regimes in retribution for those nation's citizens expressing their freedoms through media, social media, peaceful assembly, or other peaceful means. These cases should be raised bilaterally at the highest levels. Similarly, we call on the United States Mission to the United Nations to raise the profile of this alarming trend multilaterally at the United Nations, to include leading requests for a dialogue or briefings at the U.N. Security Council. Both the State Department and the U.S. Mission to the U.N. should also consider appropriate diplomatic engagement with like-minded partners on this issue with the goal of building upon existing speech and digital freedoms multilaterally. We stand with the defenders of free speech and expression in China, and in any nation across the globe where an illiberal regime is threatening these fundamental human rights. Thank you for your attention to this important matter. Respectfully,"
Democrat,Benjamin L. Cardin,"Letter to Steven Mnuchin, Secretary of the Treasury, and Jovita Carranza, Administrator of the Small Business Administration - Senators Jones, Cardin and Colleagues Call for Use of Payroll Processors to Accelerate and Simplify Disbursement of CARES Act Small Business Loans","Dear Secretary Mnuchin and Administrator Carranza, 

Restaurants, main street retailers, and other small businesses across the country are being forced to close their doors or severely limit their services in response to the coronavirus pandemic. Many will go bankrupt without customers, as folks stay home and practice social distancing and as states start enacting forced closures for schools and events. It is critical that all tools be used to distribute federal funds effectively and expeditiously, including payroll processing companies used by many small businesses. 

The Coronavirus Aid, Relief, and. Economic Security Act (CARES) Act authorized $350 billion for the Small Business Administration to provide loans of up to $10 million. Small businesses can use the loans to maintain payroll, keep workers on the books or pay for rent, mortgage and existing debt could be forgiven, provided workers stay employed for eight weeks once they receive the loan.

The Treasury Department, in consultation with the Administrator, can allow for other organizations that do not already participate in Small Business Administration lending programs to participate in the Paycheck Protection Program. 

We write to request that you allow payroll processing companies to disburse these essential funds to small businesses to reduce complications and expedite salaries to workers. In collaboration with lenders, payroll processors can play a key role in verifying payroll data to help facilitate a speedy process while also helping alleviate the risk of fraud.   

Payroll processors have the needed existing infrastructure that will enable businesses to quickly pay their workers and pending bills. Given they originate approximately 40 percent of all the payroll checks in the country and mostly cater to small businesses with 500 employees or less, involving these companies will ensure a deeper dissemination of funds nationwide to the businesses that need it most to keep their doors open.

Please consider permitting payroll processors to partner with small businesses and banks to help alleviate any potential complications for many small businesses during this tumultuous time.

 

Sincerely,"
Democrat,Dianne Feinstein,Feinstein Supports Bill Ensuring National Guardsmen Receive Full Federal Benefits,"Senator Dianne Feinstein (D-Calif.) joined Senator Tammy Duckworth (D-Ill.) and a group of their colleagues to support the National Guard COVID-19 Response Stability Act, legislation that ensures all National Guard troops activated in response to the COVID-19 pandemic receive additional benefits and allows governors to continue using the National Guard to help coronavirus response efforts.

Currently, National Guard deployments are scheduled to end in June, one day short of the 90-day threshold for Guardsmen to receive additional federal benefits such as the Post-9/11 GI Bill.

""The California National Guard has played a key role in the state's coronavirus response, including helping conduct tests, treating patients and helping staff homeless shelters. Terminating these deployments in June in order to prevent guardsmen and reservists from qualifying for retirement and federal benefits is a bad decision. We shouldn't cut off this much-needed manpower in the middle of pandemic. I hope the Trump administration allows these deployments to continue and fully supports Guard members,"" said Feinstein.

""The Trump Administration's repeated attempts to nickel and dime members of the National Guard would be wrong under any circumstance, but it is particularly offensive when these troops are responding to a deadly COVID-19 pandemic that has already killed more than 90,000 Americans,"" said Duckworth. ""This legislation would ensure that all National Guard troops activated to respond to the COVID-19 pandemic are provided with the full benefits they've earned and will give states much-needed certainty during these uncertain times.""

In addition to Feinstein and Duckworth, the legislation is also supported by Senators Tammy Baldwin (D-Wis.), Richard Blumenthal (D-Conn.), Sherrod Brown (D-Ohio), Dick Durbin (D-Ill.), Mazie Hirono (D-Hawaii), Bob Menendez (D-N.J.), Jeff Merkley (D-Ore.), Gary Peters (D-Mich.), Brian Schatz (D-Hawaii), Bernie Sanders (I-Vt.), Jeanne Shaheen (D-N.H.), Kyrsten Sinema (D-Ariz.), Debbie Stabenow (D-Mich.), Chris Van Hollen (D-Md.), Mark Warner (D-Va.), Elizabeth Warren (D-Mass.) and Ron Wyden (D-Ore.)."
Republican,Joni Ernst,Fox News - Sen. Joni Ernst: Coronavirus -- Our essential workers are our heroes. It's time we pay them back,"By Joni Ernst

Lia Basemann is a 25-year-old registered nurse at UnityPoint Health-St. Luke's Hospital in Cedar Rapids. Early on in her career, and in the middle of planning a wedding for the fall, Lia typically serves in the cardiology department.

But, like all Iowans, the COVID-19 pandemic forced her to make some changes. And, like so many others, Lia is choosing to make a difference in these tough times. Now she's voluntarily working long days on the COVID-19 floor at St. Luke's. Her work is essential to the Iowans she's caring for every single day.

And it's not just our health care professionals who are stepping up during this pandemic. Jeff Hoker, owner of Hoker Trucking in Dixon, Iowa -- who no doubt has been working long hours these days -- gives us a picture of what his truck drivers are doing during this global pandemic.

""These guys are hard workers,"" Jeff said of his drivers. ""I'll tell you right now, these guys are busting their butt every day of the week.""

Our truck and delivery drivers play an essential role during this crisis. They are working around-the-clock to deliver food and supplies to folks across the country.

Throughout the COVID-19 pandemic, essential workers in the United States have continued in their daily jobs -- to care for and protect Americans, to produce and deliver food and essential goods, and to uphold our nation's critical infrastructure. They are on the front lines of a battle, a fight, against an invisible enemy.

The invisible enemy we fight today is far different than when I served in Iraq, but the critical logistics operations, supply workers, medical professionals, and the many others who are on the front lines responding to coronavirus could not be more important to our victory.

Many of these hardworking men and women face added challenges and personal risks in their work during this pandemic, such as health concerns, reduced access to childcare, transportation interruptions, as well as an emotional toll on themselves and their loved ones.

These are nurses, truck drivers, and grocery store workers, and so many more who are all keeping life going right now.

These men and women -- our moms and dads, brothers and sisters -- are putting the livelihoods of their fellow Americans ahead of their own. Each and every morning, despite the pandemic, they wake up and go to work.

I believe these essential, front line workers deserve tax relief. That's why I'm proposing we provide a federal tax suspension for essential workers during this pandemic. I also believe we should suspend federal payroll taxes for these workers.

Our nation cannot weather this pandemic without our essential workforce, who are upholding our most critical infrastructure and industries-- ensuring Americans are fed and providing care for our loved ones. They deserve a reward for their selfless service. That's why I'm proposing we give these heroes a break.

Many of these hardworking men and women face added challenges and personal risks in their work during this pandemic, such as health concerns, reduced access to childcare, transportation interruptions, as well as an emotional toll on themselves and their loved ones.

These are nurses, truck drivers, and grocery store workers, and so many more who are all keeping life going right now.

These men and women -- our moms and dads, brothers and sisters -- are putting the livelihoods of their fellow Americans ahead of their own. Each and every morning, despite the pandemic, they wake up and go to work.

I believe these essential, front line workers deserve tax relief. That's why I'm proposing we provide a federal tax suspension for essential workers during this pandemic. I also believe we should suspend federal payroll taxes for these workers.

Our nation cannot weather this pandemic without our essential workforce, who are upholding our most critical infrastructure and industries-- ensuring Americans are fed and providing care for our loved ones. They deserve a reward for their selfless service. That's why I'm proposing we give these heroes a break."
